run_id,product_id,primary_yield_metric,yield_original,yield_definition_original,yield_calculation_method,yield_value_standardized,yield_unit_standardized,yield_standardization_note,CNT_yield_per_catalyst_g_gcat,CNT_productivity_g_gcat_h,carbon_source_conversion_percent,carbon_conversion_to_solid_percent,secondary_result_summary,CNT_type_reported,CNT_type_confirmed,product_mixture_summary,CNT_type_evidence,SWCNT_or_few_wall_evidence_summary,RBM_peak_reported,outer_diameter_mean_nm,outer_diameter_range_nm,inner_diameter_mean_nm,wall_number_summary,length_summary,morphology,alignment_or_array,Raman_ratio_type,Raman_ratio_value,Raman_laser_wavelength_nm,TGA_carbon_content_wt_percent,purified_product_purity_wt_percent,purity_basis,residue_summary,amorphous_carbon_level,BET_surface_area_product_m2_g,characterization_methods,post_treatment_or_purification,purification_condition,application_property_summary,notes
PAPER_2023_48456Z_NR_H2_000,PROD_48456Z_NR_H2_000,CNT_yield_per_catalyst,10.16% carbon yield based on carbon feed; 0.85 g-CNTs/g-catalysts,Carbon yield (%) = [(product weight - catalyst weight) / carbon feed] × 100; g-CNTs/g-catalysts = (product - catalyst)/catalyst,reported Eqs. (2)-(3) and Table 4,10.16,% carbon yield based on carbon feed,Reported value retained; not methane conversion or purified CNT yield.,0.85,0.2833,not_reported,not_reported,not_reported,MWCNTs,MWCNT-reported heterogeneous CNT/carbon product; exact wall-count distribution uncertain,"Authors identify MWCNTs and measure MWCNT diameters by SEM; product contains amorphous carbon and residual catalyst/support, while wall-count results are not shown in the main PDF.; dense CNTs with some amorphous carbon; highly non-uniform diameter distribution","Authors identify MWCNTs and measure MWCNT diameters by SEM; product contains amorphous carbon and residual catalyst/support, while wall-count results are not shown in the main PDF.",Figure 6 labels an RBM feature and the study-wide diameter distribution includes <5 nm tubes; SWCNT/DWCNT are neither confirmed nor excluded.,labeled in Fig. 6; not interpreted by authors,29.28,study-wide: <5 to >100,not_reported,not_reported in main PDF,not_reported,dense CNTs with some amorphous carbon; highly non-uniform diameter distribution,not_reported,IG/ID,3.14,532,52.81,not_reported,as_synthesized_TGA_carbon_content,not_reported,present; not separately quantified,not_reported,FE-SEM; TEM described; XRD; Raman; TGA; GC-TCD,none before reported as-prepared characterization,not_applicable for as-prepared product,not_reported,"MIXED PRODUCT WARNING: partial_mixed confirms an MWCNT component, not clean product success. 52.81% is TGA carbon content of as-prepared product. Diameter SD=25.03 nm. CNT_productivity is calculated as 0.85/3 h."
PAPER_2023_48456Z_NR_H2_025,PROD_48456Z_NR_H2_025,CNT_yield_per_catalyst,17.06% carbon yield based on carbon feed; 1.35 g-CNTs/g-catalysts,Eq. (2) carbon yield based on carbon feed; Eq. (3) g-CNTs/g-catalyst,reported Table 4,17.06,% carbon yield based on carbon feed,Table 4 reports the same 17.06% as the 1:1 condition despite different product mass and g/g; warning retained.,1.35,0.45,not_reported,not_reported,not_reported,MWCNTs,MWCNT-reported heterogeneous CNT/carbon product; exact wall-count distribution uncertain,Part of the same MWCNT concentration series; run-specific wall-count and Raman evidence are not reported.; highly distributed CNT diameter; product mixture not fully quantified,Part of the same MWCNT concentration series; run-specific wall-count and Raman evidence are not reported.,No run-specific RBM or wall-count result; SWCNT/DWCNT not excluded.,not_reported_for_this_run,36.81,study-wide: <5 to >100,not_reported,not_reported,not_reported,highly distributed CNT diameter; product mixture not fully quantified,not_reported,not_reported,not_reported,not_reported,not_reported,not_reported,not_reported,not_reported,not separately quantified for this run,not_reported,SEM diameter analysis; GC-TCD; other run-specific characterization not reported,none reported,not_applicable,not_reported,MIXED PRODUCT WARNING applies. Diameter SD=24.72 nm. Productivity calculated as 1.35/3 h.
PAPER_2023_48456Z_NR_H2_050,PROD_48456Z_NR_H2_050,CNT_yield_per_catalyst,17.06% carbon yield based on carbon feed; 1.47 g-CNTs/g-catalysts,Eq. (2) carbon yield based on carbon feed; Eq. (3) g-CNTs/g-catalyst,reported Table 4,17.06,% carbon yield based on carbon feed,Reported value retained with Table 4 consistency warning.,1.47,0.49,not_reported,not_reported,not_reported,MWCNTs,MWCNT-reported heterogeneous CNT/carbon product; exact wall-count distribution uncertain,Authors identify the series as MWCNT synthesis; run-specific wall-count data are absent.; highly distributed CNT diameter; product mixture not fully quantified,Authors identify the series as MWCNT synthesis; run-specific wall-count data are absent.,No run-specific RBM or wall-count result; SWCNT/DWCNT not excluded.,not_reported_for_this_run,35.72,study-wide: <5 to >100,not_reported,not_reported,not_reported,highly distributed CNT diameter; product mixture not fully quantified,not_reported,not_reported,not_reported,not_reported,not_reported,not_reported,not_reported,not_reported,not separately quantified for this run,not_reported,SEM diameter analysis; GC-TCD,none reported,not_applicable,not_reported,Authors call CH4:H2=1:1 the optimum of this concentration series. MIXED PRODUCT WARNING applies. Diameter SD=22.82 nm. Productivity calculated as 1.47/3 h.
PAPER_2023_48456Z_NR_H2_100,PROD_48456Z_NR_H2_100,CNT_yield_per_catalyst,10.85% in Table 3; 15.85% in Table 4 for same nR-wH2 / CH4:H2=1:2 condition; 1.37 g-CNTs/g-catalysts in both tables,Eq. (2) carbon yield based on carbon feed; Eq. (3) g-CNTs/g-catalyst,reported values conflict across Tables 3 and 4,not_reported,% carbon yield based on carbon feed,Not standardized pending human resolution of 10.85% versus 15.85%; use reported g-CNT/g-cat=1.37 for comparison.,1.37,0.4567,not_reported,not_reported,not_reported,MWCNTs,MWCNT-reported heterogeneous CNT/carbon product; exact wall-count distribution uncertain,Authors measure MWCNT diameter and show dense CNTs with amorphous carbon; wall count is not reported in the main PDF.; dense CNTs with some amorphous carbon; broad diameter distribution,Authors measure MWCNT diameter and show dense CNTs with amorphous carbon; wall count is not reported in the main PDF.,Figure 6 labels RBM and study-wide diameters include <5 nm; SWCNT/DWCNT not confirmed or excluded.,labeled in Fig. 6; not interpreted by authors,32.72,study-wide: <5 to >100,not_reported,not_reported,not_reported,dense CNTs with some amorphous carbon; broad diameter distribution,not_reported,IG/ID,3.07,532,62.91,not_reported,as_synthesized_TGA_carbon_content,not_reported,present; not separately quantified,not_reported,FE-SEM; TEM described; XRD; Raman; TGA; GC-TCD,none before as-prepared characterization,not_applicable,not_reported,MIXED PRODUCT WARNING applies. 62.91% is TGA carbon content. Diameter SD=25.80 nm. Productivity calculated as 1.37/3 h.
PAPER_2023_48456Z_NR_H2_150,PROD_48456Z_NR_H2_150,CNT_yield_per_catalyst,10.51% carbon yield based on carbon feed; 0.93 g-CNTs/g-catalysts,Eq. (2) carbon yield based on carbon feed; Eq. (3) g-CNTs/g-catalyst,reported Table 4,10.51,% carbon yield based on carbon feed,Reported excess-H2 condition.,0.93,0.31,not_reported,not_reported,not_reported,MWCNTs,MWCNT-reported heterogeneous CNT/carbon product; exact wall-count distribution uncertain,Same MWCNT concentration series; no run-specific wall count.; highly distributed CNT diameter,Same MWCNT concentration series; no run-specific wall count.,No run-specific RBM or wall-count result; SWCNT/DWCNT not excluded.,not_reported_for_this_run,30.81,study-wide: <5 to >100,not_reported,not_reported,not_reported,highly distributed CNT diameter,not_reported,not_reported,not_reported,not_reported,not_reported,not_reported,not_reported,not_reported,not separately quantified,not_reported,SEM diameter analysis; GC-TCD,none reported,not_applicable,not_reported,MIXED PRODUCT WARNING applies. Diameter SD=19.64 nm. Productivity calculated as 0.93/3 h.
PAPER_2023_48456Z_R_H2_000,PROD_48456Z_R_H2_000,CNT_yield_per_catalyst,67.77% carbon yield based on carbon feed; 5.77 g-CNTs/g-catalysts,Eq. (2) carbon yield based on carbon feed; Eq. (3) g-CNTs/g-catalyst,reported Table 3; final product mass approximately 3.41 g in text,67.77,% carbon yield based on carbon feed,Highest reported overview-route yield; not methane conversion or purified CNT yield.,5.77,1.9233,not_reported,not_reported,not_reported,MWCNTs,MWCNT-reported heterogeneous CNT/carbon product; exact wall-count distribution uncertain,Authors assign MWCNT and measure diameters; product contains amorphous carbon and residual catalyst/support.; dense CNTs with some amorphous carbon; broad diameter distribution,Authors assign MWCNT and measure diameters; product contains amorphous carbon and residual catalyst/support.,"Figure 6 labels RBM; wall-count result absent in main PDF, so SWCNT/DWCNT not excluded.",labeled in Fig. 6; not interpreted by authors,43.25,study-wide: <5 to >100,not_reported,not_reported,not_reported,dense CNTs with some amorphous carbon; broad diameter distribution,not_reported,IG/ID,2.58,532,82,not_reported,as_synthesized_TGA_carbon_content,not_reported,present; not separately quantified,not_reported,FE-SEM; TEM described; XRD; Raman; TGA; GC-TCD,none before as-prepared characterization,not_applicable,not_reported,MIXED PRODUCT WARNING applies. 82.00% is TGA carbon content. Diameter SD=27.53 nm. Productivity calculated as 5.77/3 h.
PAPER_2023_48456Z_R_H2_100,PROD_48456Z_R_H2_100,CNT_yield_per_catalyst,64.88% carbon yield based on carbon feed; 5.61 g-CNTs/g-catalysts,Eq. (2) carbon yield based on carbon feed; Eq. (3) g-CNTs/g-catalyst,reported Table 3; final product mass approximately 3.33 g in text,64.88,% carbon yield based on carbon feed,Reported H2-combined route; not purified CNT yield.,5.61,1.87,not_reported,not_reported,not_reported,MWCNTs,MWCNT-reported heterogeneous CNT/carbon product; exact wall-count distribution uncertain,Authors assign MWCNT and measure diameters; product contains amorphous carbon and residual catalyst/support.; dense CNTs with some amorphous carbon; broad diameter distribution,Authors assign MWCNT and measure diameters; product contains amorphous carbon and residual catalyst/support.,"Figure 6 labels RBM; wall-count result absent in main PDF, so SWCNT/DWCNT not excluded.",labeled in Fig. 6; not interpreted by authors,45.41,study-wide: <5 to >100,not_reported,not_reported,not_reported,dense CNTs with some amorphous carbon; broad diameter distribution,not_reported,IG/ID,2.56,532,87.16,not_reported,as_synthesized_TGA_carbon_content,not_reported,present; not separately quantified,not_reported,FE-SEM; TEM described; XRD; Raman; TGA; GC-TCD,none before as-prepared characterization,not_applicable,not_reported,MIXED PRODUCT WARNING applies. 87.16% is TGA carbon content. Diameter SD=27.53 nm. Productivity calculated as 5.61/3 h.
