source_id,fulltext_url,fulltext_type,url_source,access_type,license,verification_status,checked_at,reviewer,note
LIT_3D8F9EFA937173D0,https://ris.utwente.nl/ws/files/31939082/decomposition.pdf,pdf,University of Twente Research Information,legal_oa,cc-by-nc-nd,verified,2026-07-16T02:36:00Z,gpt-5-codex-high-tier-llm,Institutional repository copy; DOI and title verified
LIT_3D2FAA624663FA97,https://doiserbia.nb.rs/img/doi/1451-9372/2009/1451-93720904263R.pdf,pdf,DOISerbia official full text,legal_oa,,verified,2026-07-16T02:36:00Z,gpt-5-codex-high-tier-llm,Official journal full-text URL; non-www host avoids legacy certificate mismatch
LIT_2A2F8594DBA4A040,https://mdpi-res.com/d_attachment/ChemEngineering/ChemEngineering-03-00026/article_deploy/ChemEngineering-03-00026.pdf,pdf,MDPI official static asset,legal_oa,cc-by,verified,2026-07-16T02:36:00Z,gpt-5-codex-high-tier-llm,Official publisher static PDF; DOI and title verified
LIT_E099468AD3074B0A,https://aaltodoc.aalto.fi/server/api/core/bitstreams/da0060d1-5ce2-4871-aa8a-7340dbf21a8f/content,pdf,Aaltodoc institutional repository,legal_oa,cc-by,verified,2026-07-16T02:36:00Z,gpt-5-codex-high-tier-llm,Published version marked openAccess in repository
LIT_D1AF7614B5E2F098,https://aaltodoc.aalto.fi/server/api/core/bitstreams/8d62715c-c654-48d9-906c-2517ad05e101/content,pdf,Aaltodoc institutional repository,legal_oa,,verified,2026-07-16T02:36:00Z,gpt-5-codex-high-tier-llm,Accepted version marked openAccess in repository
LIT_4B3D3C5CD3B8D731,https://dr.ntu.edu.sg/server/api/core/bitstreams/0ece086b-9d80-4420-a2b5-34e2467d688f/content,pdf,NTU Digital Repository,legal_oa,,verified,2026-07-16T02:36:00Z,gpt-5-codex-high-tier-llm,Institutional repository copy; handle and filename verified
